{
  "schemaVersion": "1.0",
  "scenarioKey": "severe-alarm-explanation",
  "scenarioVersion": 1,
  "title": "设备不可用告警可能影响业务可用性",
  "summary": "设备当前离线，告警为 critical；需先确认供电与传输链路。",
  "severity": "critical",
  "confidence": 0.82,
  "facts": [
    {
      "id": "fact-1",
      "text": "任务在设备离线期间失败。",
      "evidenceRefs": [
        "tool:get.devices.by_id"
      ]
    },
    {
      "id": "fact-2",
      "text": "近 24 小时存在 3 次同类失败。",
      "evidenceRefs": [
        "tool:get.devices.tasks"
      ]
    }
  ],
  "hypotheses": [
    {
      "id": "hyp-1",
      "text": "设备连接中断是本次失败的主要原因。",
      "confidence": 0.86,
      "evidenceRefs": [
        "fact-1",
        "fact-2"
      ]
    }
  ],
  "resourceRefs": [
    {
      "type": "task",
      "id": "task-123",
      "role": "task",
      "label": "配置任务"
    },
    {
      "type": "device",
      "id": "device-456",
      "role": "device",
      "label": "SN001"
    }
  ],
  "details": {
    "alarmId": "alarm-88",
    "alarmCode": "CELL_UNAVAILABLE",
    "affectedDeviceIds": [
      "device-22"
    ],
    "impactCategory": "availability",
    "relatedChangeSummary": null
  },
  "suggestedActions": [
    {
      "type": "open-resource",
      "label": "查看任务",
      "resourceRole": "task"
    },
    {
      "type": "continue-agent",
      "label": "继续询问 Agent",
      "promptKey": "task-failure-followup"
    },
    {
      "type": "dismiss",
      "label": "忽略"
    }
  ],
  "presentation": {
    "surfaces": [
      "attention",
      "task-detail"
    ],
    "sections": [
      "summary",
      "facts",
      "hypotheses",
      "details",
      "resources",
      "suggestedActions"
    ],
    "icon": "task-error"
  }
}
